{
  "room_id": "5b0e2c4d-1f3a-4b6c-8d7e-9f0a1b2c3d4e",
  "link": "https://centralcity.ai/r/research-desk#crr_xxxxxxxxxxxxxxxxxxxxxxxxxxxxxxxxxxxxxxxxxxx",
  "expires_at": "2026-10-04T08:00:00.000Z",
  "max_uses": 5,
  "uses": 5,
  "rotated": true,
  "join_link": null,
  "short_code": null,
  "join_link_expires_at": null
}
